{
  "schemaVersion": "2.0",
  "meta": {
    "title": "Graphs Are Awesome",
    "author": "Yohei Nakajima",
    "event": "GraphCon",
    "date": "July 25, 2026",
    "presentedDate": "2026-07-25",
    "reviewedDate": "2026-07-24",
    "repository": "https://github.com/yoheinakajima/prezograph",
    "disclosure": "FalkorDB is an Untapped Capital portfolio company. Mem0 is an Agent Fund portfolio company.",
    "source": "Migrated from graph-deck_1.html"
  },
  "theme": {
    "colors": {
      "background": "#f4f0e8",
      "surface": "#fffdf8",
      "ink": "#14211c",
      "muted": "#52655c",
      "light": "#65766e",
      "hair": "#cfc9bb",
      "indigo": "#4f46c8",
      "green": "#17714d",
      "tan": "#8a4b10"
    }
  },
  "entities": {
    "t_hub": {
      "title": "Graphs are awesome",
      "sub": "because relationships are where the meaning lives",
      "body": "An interactive presentation whose structure, sequence, and camera are all generated from JSON."
    },
    "t_speaker": {
      "title": "Yohei Nakajima",
      "body": "Founder, Untapped Capital · creator of BabyAGI and Prezograph"
    },
    "t_conf": {
      "title": "GraphCon · Jul 25 2026"
    },
    "n_invest": {
      "title": "invest"
    },
    "n_build": {
      "title": "build"
    },
    "n_untapped": {
      "title": "Untapped Capital",
      "sub": "pre-seed fund",
      "tip": "Pre-seed venture fund backing unexpected founders — FalkorDB is in the portfolio."
    },
    "n_agentfund": {
      "title": "Agent Fund",
      "sub": "agents backing agents",
      "tip": "Backing agent-native startups — Mem0 is in the portfolio."
    },
    "y_babyagi": {
      "title": "BabyAGI",
      "sub": "Mar 2023",
      "body": "a task list that runs itself",
      "tip": "The autonomous agent that started the task-loop wave — a task queue the agent creates, prioritizes, and executes. The tasks form a graph."
    },
    "y_insta": {
      "title": "InstaGraph",
      "sub": "Sep 2023",
      "body": "text → instant knowledge graph",
      "tip": "Paste text or a URL, get a knowledge graph. The moment converting anything into nodes and edges felt one-click."
    },
    "y_mind": {
      "title": "MindGraph",
      "sub": "Mar 2024",
      "body": "graph-native memory starter kit",
      "tip": "Open-source starter kit for graph-as-memory — an API-first proto-CRM where the graph is the database."
    },
    "y_pretty": {
      "title": "PrettyGraph",
      "sub": "2024",
      "body": "text → pretty graphs",
      "tip": "A small experiment in making text-to-graph output beautiful. Same data, better drawing — order from chaos."
    },
    "y_b2": {
      "title": "BabyAGI 2",
      "sub": "Sep 2024",
      "body": "functionz — a self-building function graph",
      "tip": "Rebuilt around a function registry: functions, their dependencies, and triggers stored as a graph the agent extends — the functiongraph."
    },
    "y_active": {
      "title": "ActiveGraph",
      "sub": "2025 – 26",
      "body": "event + context graphs for agents",
      "tip": "Current work: event-sourced context graphs — the living state layer this talk keeps circling back to."
    },
    "oc_data": {
      "title": "The same seven facts",
      "sub": "Two representations"
    },
    "oc_order": {
      "title": "Graph-native",
      "sub": "Relationships are first-class",
      "body": "Multi-hop questions stay close to the way the problem is described."
    },
    "oc_chaos": {
      "title": "Relational",
      "sub": "Relationships are reconstructed",
      "body": "Joins are powerful, but relationship-heavy questions often require more modeling and query work."
    },
    "ev_hub": {
      "title": "Everything is a graph"
    },
    "ev_social": {
      "title": "Social",
      "sub": "people · trust · influence",
      "body": "(alice)-[:follows]->(bob)"
    },
    "ev_business": {
      "title": "Business",
      "sub": "companies · deals · funds",
      "body": "(fund)-[:invested]->(acme)"
    },
    "ev_objects": {
      "title": "Objects",
      "sub": "parts · dependencies",
      "body": "(wheel)-[:part_of]->(car)"
    },
    "ev_places": {
      "title": "Places",
      "sub": "locations · routes",
      "body": "(nrt)-[:flight]->(sea)"
    },
    "ev_beliefs": {
      "title": "Beliefs",
      "sub": "claims · evidence · revision",
      "body": "(claim)-[:based_on]->(src)"
    },
    "i_alice": {
      "title": "alice"
    },
    "i_bob": {
      "title": "bob"
    },
    "i_fund": {
      "title": "a fund"
    },
    "i_acme": {
      "title": "acme"
    },
    "i_car": {
      "title": "car"
    },
    "i_wheel": {
      "title": "wheel"
    },
    "i_nrt": {
      "title": "nrt"
    },
    "i_sea": {
      "title": "sea"
    },
    "i_claim": {
      "title": "a claim"
    },
    "i_src": {
      "title": "the source"
    },
    "tl_hub": {
      "title": "Agents became graph-shaped in public",
      "sub": "2022 → 2026",
      "body": "Plans, tool calls, memory, teams, interoperability, and reusable skills all made relationships explicit."
    },
    "tl_react": {
      "title": "ReAct",
      "sub": "Oct 2022",
      "body": "interleave reasoning + acting — the base loop",
      "source": "https://arxiv.org/abs/2210.03629",
      "sourceDate": "2026-07-24"
    },
    "tl_baby": {
      "title": "BabyAGI / AutoGPT / ToT",
      "sub": "Mar – May 2023",
      "body": "task queues + reasoning trees"
    },
    "tl_fc": {
      "title": "Function calling",
      "sub": "Jun 2023",
      "body": "structured tool edges from the model",
      "source": "https://openai.com/index/function-calling-and-other-api-updates/",
      "sourceDate": "2026-07-24"
    },
    "tl_ag": {
      "title": "AutoGen + Assistants API",
      "sub": "2023 · teams + threaded state",
      "body": "Agent teams and persistent threads made conversational state and delegation explicit. The Assistants API is now deprecated.",
      "source": "https://help.openai.com/en/articles/8550641-assistants-",
      "sourceDate": "2026-07-24"
    },
    "tl_lg": {
      "title": "LangGraph",
      "sub": "Jan 2024",
      "body": "explicit nodes, edges, cycles, checkpoints"
    },
    "tl_gr": {
      "title": "Microsoft GraphRAG",
      "sub": "Jul 2024",
      "body": "retrieval over an entity graph + community summaries",
      "source": "https://www.microsoft.com/en-us/research/blog/graphrag-new-tool-for-complex-data-discovery-now-on-github/",
      "sourceDate": "2026-07-24"
    },
    "tl_mcp": {
      "title": "MCP",
      "sub": "Nov 2024",
      "body": "open standard — tools + resources as a context graph",
      "source": "https://www.anthropic.com/news/model-context-protocol",
      "sourceDate": "2026-07-24"
    },
    "tl_op": {
      "title": "Operator → ChatGPT agent",
      "sub": "2025 · UI actions",
      "body": "Operator introduced browser-acting research preview capabilities later integrated into ChatGPT agent.",
      "source": "https://openai.com/index/introducing-operator/",
      "sourceDate": "2026-07-24"
    },
    "inv_g_old": {
      "title": "graph-first"
    },
    "inv_ont_old": {
      "title": "Model-first ontology",
      "sub": "Define before observing use",
      "body": "Useful when the domain is stable, but expensive when behavior changes faster than the model."
    },
    "inv_ing": {
      "title": "ingestion & schema",
      "sub": "built before anyone benefits"
    },
    "inv_use_old": {
      "title": "usage",
      "sub": "finally — if anyone still trusts it"
    },
    "inv_decay": {
      "title": "trust decays",
      "sub": "no correction loop · stale facts"
    },
    "inv_g_new": {
      "title": "agent-first"
    },
    "inv_use_new": {
      "title": "usage",
      "sub": "agent workflows run day one"
    },
    "inv_prop": {
      "title": "proposals",
      "sub": "LLM extracts nodes + edges from traces"
    },
    "inv_val": {
      "title": "validators",
      "sub": "humans + rules approve or reject"
    },
    "inv_ont_new": {
      "title": "Living ontology",
      "sub": "Proposed from use · reviewed by people",
      "body": "Let repeated behavior suggest structure, then validate, govern, and version it."
    },
    "st_before": {
      "title": "The old job",
      "sub": "finish the ontology",
      "body": "Model the world before usage.",
      "tip": "Graph-first: months of modeling before the first user query. Ends in trust decay — see the inversion."
    },
    "st_after": {
      "title": "The new job",
      "sub": "keep living state trustworthy",
      "body": "Continuously answer five relationship questions as usage evolves.",
      "tip": "Agent-first: the workflow runs from day one and the job becomes tending the graph it generates."
    },
    "st_hub": {
      "title": "agent state",
      "sub": "memory · context · action"
    },
    "st_id": {
      "title": "identity",
      "sub": "who is who?"
    },
    "st_perm": {
      "title": "permissions",
      "sub": "who can see or act?"
    },
    "st_time": {
      "title": "temporal truth",
      "sub": "what was true when?"
    },
    "st_prov": {
      "title": "provenance",
      "sub": "why believe this?"
    },
    "st_corr": {
      "title": "correction loop",
      "sub": "how does it improve?"
    },
    "mk_hub": {
      "title": "A market forms around the questions",
      "sub": "Infrastructure layers + relationship workloads",
      "tip": "The picks-and-shovels layer forming around living graphs — hover any segment or company for what it does and how it is doing."
    },
    "seg_db": {
      "title": "Graph databases",
      "sub": "store the world graph",
      "tip": "Databases purpose-built to store and traverse nodes and edges — the persistence layer for world graphs. Nine companies, from a ~$581M leader to fresh seeds."
    },
    "seg_build": {
      "title": "KG construction",
      "sub": "documents → nodes + edges",